{
  "id": "src-reverent-otto-idea-holy-1917",
  "title": "The Idea of the Holy: An Inquiry into the Non-Rational Factor in the Idea of the Divine and Its Relation to the Rational",
  "creators": [
    "Rudolf Otto",
    "John W. Harvey"
  ],
  "source_type": "scholarly-book",
  "source_roles": [
    "recognition",
    "definition",
    "craft-support"
  ],
  "reliability_tier": 2,
  "publication": {
    "publisher_or_container": "Oxford University Press (H. Milford)",
    "published_date": "1923",
    "edition": "English translation by John W. Harvey of Das Heilige (1917); standard edition reissued 1958",
    "doi": null,
    "isbn": "9780195002102"
  },
  "languages": [
    "en",
    "de"
  ],
  "regions": [
    "Germany",
    "United Kingdom"
  ],
  "access": {
    "locator": "https://openlibrary.org/search?q=The+Idea+of+the+Holy+Otto+Harvey",
    "accessed_at": "2026-09-24",
    "access_conditions": "library"
  },
  "verification": {
    "verified_directly": true,
    "verified_at": "2026-09-24T00:00:00Z",
    "verified_by": "Tone Layer researcher (tone-reverent)",
    "verification_notes": "English translation and publisher verified via Open Library (first English publication 1923, Oxford University Press / H. Milford; trans. John W. Harvey). Core concepts (numinous; ganz Andere / 'wholly other'; mysterium tremendum et fascinans; sui generis non-rational religious feeling; apophatic approach) cross-checked against the standard scholarly account of The Idea of the Holy."
  },
  "axis_ids": [
    "tone-reverent"
  ],
  "claim_ids": [
    "clm-tone-reverent-numinous-wholly-other",
    "clm-tone-reverent-apophatic-construal"
  ],
  "translation": {
    "is_translation": true,
    "original_language": "de",
    "translator": "John W. Harvey",
    "limitations": [
      "Claims concern Otto's conceptual analysis, not German lexical nuance; Latin tags (mysterium tremendum et fascinans) are Otto's own and survive translation."
    ]
  },
  "copyright": {
    "status": "copyrighted",
    "repository_copy_allowed": false,
    "notes": "1917 German original public domain; Harvey translation rights vary by edition; analytical citation only; no passages reproduced."
  }
}
